title;link
Pese al fallo de la Justicia, la Ciudad mantendrá las clases presenciales;https://www.ambito.com/politica/clases-presenciales/pese-al-fallo-la-justicia-la-ciudad-mantendra-las-n5186119
Justicia federal suspende las clases presenciales en la Ciudad;https://www.ambito.com/politica/clases-presenciales/justicia-federal-suspende-las-la-ciudad-n5186097
Dólar blue ante un punto de inflexión: ¿despega o continúa el letargo?;https://www.ambito.com/finanzas/dolar-blue/un-punto-inflexion-despega-o-continua-el-letargo-n5186069
Alquilar en la Ciudad aumentó 50% en un año: ¿Qué hay detrás?;https://www.ambito.com/economia/alquileres/alquilar-la-ciudad-aumento-50-un-ano-que-hay-detras-n5186057
Exclusivo: Congreso concluye que hubo espionaje ilegal en la era Macri;https://www.ambito.com/politica/espionaje/exclusivo-congreso-concluye-que-hubo-ilegal-la-era-macri-n5185946
Contacto Massa-Larreta para rescatar AMBA: ¿Cae acuerdo por PASO?;https://www.ambito.com/politica/paso/contacto-massa-larreta-rescatar-amba-cae-acuerdo-n5186081
Coparticipación: para Nación, la Ciudad no tiene el estatus para discutir en la Corte;https://www.ambito.com/politica/ciudad-buenos-aires/coparticipacion-nacion-la-ciudad-no-tiene-el-estatus-discutir-la-corte-n5186072
Cuentas públicas: el primer trimestre arrojó el resultado financiero más bajo en 6 años;https://www.ambito.com/economia/deficit/cuentas-publicas-el-primer-trimestre-arrojo-el-resultado-financiero-mas-6-anos-n5186086
Promulgan la reforma del Impuesto a las Ganancias: cuánto a vas dejar de pagar;https://www.ambito.com/economia/ganancias/cuales-son-las-claves-del-proyecto-y-como-impacta-el-salario-n5175501
Nuevos créditos para construcción: cómo son, cuáles son los requisitos y cómo anotarse;https://www.ambito.com/economia/construccion/programa-casa-propia-como-son-los-nuevos-creditos-hipotecarios-n5185787
Dólar CCL encadenó 15 subas seguidas (BCRA ya compró más de u$s1.000 millones en abril);https://www.ambito.com/finanzas/dolar/hoy-cuanto-cerro-este-martes-20-abril-n5185882
El dólar blue cerró estable y quedó $10 por debajo del CCL;https://www.ambito.com/finanzas/dolar/blue-hoy-cuanto-cerro-este-martes-20-abril-n5185881
"El S&P Merval sufrió su peor caída en un mes; ADRs perdieron hasta 4,7% en Wall Street";https://www.ambito.com/finanzas/sp-merval/el-sufrio-su-peor-caida-un-mes-adrs-perdieron-47-wall-street-n5186001
DogeDay: cómo los seguidores de Dogecoin llevaron la criptomoneda a un nuevo récord;https://www.ambito.com/negocios/bitcoin/dogeday-como-los-seguidores-dogecoin-llevaron-la-criptomoneda-un-nuevo-record-n5185912
Los nuevos hábitos del consumidor argentino en la era del comercio electrónico;https://www.ambito.com/negocios/comercio-electronico/los-nuevos-habitos-del-consumidor-argentino-la-era-del-n5185972
Banco del Sol: tu banco en una app con la mejor tasa del mercado;https://www.ambito.com/economia/bancos/banco-del-sol-tu-banco-una-app-la-mejor-tasa-del-mercado-n5185898
EEUU: condena histórica contra el policía que mató a George Floyd;https://www.ambito.com/mundo/george-floyd/eeuu-condena-historica-contra-el-policia-que-mato-n5186116
Los argumentos del juez para revocar las clases presenciales en la Ciudad;https://www.ambito.com/politica/ciudad/los-argumentos-del-juez-revocar-las-clases-presenciales-la-n5186108
Detuvieron al principal sospechoso del femicidio en Los Toldos;https://www.ambito.com/informacion-general/femicidio/detuvieron-al-principal-sospechoso-del-los-toldos-n5185944
Cayó más de 40% el consumo de productos cuidado Covid-19 en marzo;https://www.ambito.com/economia/consumo/cayo-mas-40-el-productos-cuidado-covid-19-marzo-n5186017
Netflix no cumple con expectativas de nuevos suscriptores y se desploman sus acciones;https://www.ambito.com/negocios/netflix/no-cumple-expectativas-nuevos-suscriptores-y-se-desploman-sus-acciones-n5186091
Coronavirus: reportan 29.145 nuevos casos y 316 muertes en 24 horas;https://www.ambito.com/informacion-general/coronavirus/cuantos-casos-hay-hoy-la-argentina-n5176993
Según la UIA, en febrero la actividad industrial tuvo una caída del 5,2%;https://www.ambito.com/economia/uia/segun-la-febrero-la-actividad-industrial-tuvo-una-caida-del-52-n5186078
El plazo fijo tradicional pierde ante la inflación y surge otra alternativa que protege tu salario;https://www.ambito.com/negocios/inversiones/nacio-una-inversion-estrella-el-plazo-fijo-uva-crecio-145-y-prospera-al-ritmo-la-inflacion-n5182776
El bitcoin vuelve a caer y se mantiene cerca de los u$s55.000;https://www.ambito.com/finanzas/bitcoin/el-vuelve-caer-y-se-mantiene-cerca-los-us55000-n5185892
Cómo y dónde comprar Ethereum;https://www.ambito.com/finanzas/criptomonedas/como-y-donde-comprar-ethereum-n5186071
Binance quemó u$s500 millones de dólares en BNB;https://www.ambito.com/opiniones/criptomonedas/binance-quemo-us500-millones-dolares-bnb-n5185648
Una semana  vertiginosa;https://www.ambito.com/secciones-especiales/charlas-quincho/s-n5185567
Gira complicada;https://www.ambito.com/politica/charlas-quincho/gira-complicada-n5185574
Biocombustibles, Hidrovía y cosecha;https://www.ambito.com/politica/charlas-quincho/biocombustibles-hidrovia-y-cosecha-n5185575
Gobierno lanzó créditos para construcción de vivienda con tasa atada al salario;https://www.ambito.com/economia/alberto-fernandez/gobierno-lanzo-creditos-construccion-vivienda-tasa-atada-al-salario-n5185769
Las claves para sumar fondos al blanqueo con destino a obras de construcción;https://www.ambito.com/opiniones/impuesto/las-claves-sumar-fondos-al-blanqueo-destino-obras-construccion-n5185994
Lo que dejó el primer cuatrimestre: estabilidad cambiaria, suba de reservas y más plazos fijos en dólares;https://www.ambito.com/economia/dolar/lo-que-dejo-el-primer-cuatrimestre-estabilidad-cambiaria-suba-reservas-y-mas-plazos-fijos-es-n5185951
Qué son las ofertas de trabajo ocultas y cómo encontrarlas;https://www.ambito.com/informacion-general/trabajo/que-son-las-ofertas-ocultas-y-como-encontrarlas-n5185909
Clases: 6 de cada 10 familias dicen que la virtualidad aumenta el estrés en el hogar;https://www.ambito.com/informacion-general/clases/6-cada-10-familias-dicen-que-la-virtualidad-aumenta-el-estres-el-hogar-n5186008
Hay seis niños internados con Covid-19 en el Hospital Gutiérrez: dos están en terapia intensiva;https://www.ambito.com/informacion-general/covid-19/hay-seis-ninos-internados-el-hospital-gutierrez-dos-estan-terapia-intensiva-n5185985
La vacuna Sputnik V ya se fabrica en la Argentina;https://www.ambito.com/informacion-general/sputnik-v/la-vacuna-ya-se-fabrica-la-argentina-n5185995
EEUU recomienda no viajar a Argentina y Brasil por la pandemia;https://www.ambito.com/mundo/brasil/eeuu-recomienda-no-viajar-argentina-y-la-pandemia-n5185927
¿Cuál es la situación de los hospitales públicos en la Ciudad?;https://www.ambito.com/informacion-general/covid-19/cual-es-la-situacion-los-hospitales-publicos-la-ciudad-n5185981
Chile, cerca del colapso: la ocupación de las terapias intensivas está cerca del 100%;https://www.ambito.com/mundo/chile/cerca-del-colapso-la-ocupacion-las-terapias-intensivas-esta-cerca-del-100-n5186045
Buenos Aires suma más distritos en Fase 2 y suspenden clases presenciales;https://www.ambito.com/nacional/covid-19/buenos-aires-suma-mas-distritos-fase-2-y-suspenden-clases-presenciales-n5185926
Clases presenciales: Justicia bonaerense se declaró incompetente en causas y pide que resuelva la Corte;https://www.ambito.com/politica/justicia/clases-presenciales-bonaerense-se-declaro-incompetente-causas-y-pide-que-resuelva-la-corte-n5185971
Ciudad: los mayores de 65 años ya se pueden anotar para recibir la vacuna contra el Covid-19;https://www.ambito.com/informacion-general/vacuna/como-sacar-turno-rse-ciudad-y-provincia-n5170409
Baradel apuntó contra la oposición: ¿Por qué no se preocuparon por la educación cuando eran gobierno?;https://www.ambito.com/politica/clases/baradel-apunto-contra-la-oposicion-por-que-no-se-preocuparon-la-educacion-cuando-eran-gobierno-n5185903
Tren a Vaca Muerta: los planes para unir Añelo con Bahía Blanca y el Pacífico;https://www.ambito.com/energia/vaca-muerta/tren-los-planes-unir-anelo-bahia-blanca-y-el-pacifico-n5185531
E3F, la iniciativa francesa que frenaría u$s40.100 millones en combustibles fósiles;https://www.ambito.com/energia/combustibles/e3f-la-iniciativa-francesa-que-frenaria-us40100-millones-fosiles-n5185532
Piquetes en Vaca Muerta: pérdidas millonarias y... ¿falta de gas?;https://www.ambito.com/energia/gas/piquetes-vaca-muerta-perdidas-millonarias-y-falta-n5185533
Jujuy avanza en el proyecto de reconversión de buses diésel a eléctricos con la UNLP;https://www.ambito.com/energia/jujuy/avanza-el-proyecto-reconversion-buses-diesel-electricos-la-unlp-n5185535
Una falla en WhatsApp expone tus datos más sensibles;https://www.ambito.com/informacion-general/whatsapp/una-falla-expone-tus-datos-mas-sensibles-n5185896
FIFA 22 y una grave crisis en puerta: ¿un golpe de nocaut?;https://www.ambito.com/informacion-general/fifa/22-y-una-grave-crisis-puerta-un-golpe-nocaut-n5185905
¿Cómo exportar y borrar las contraseñas de Google Chrome?;https://www.ambito.com/informacion-general/tecnologia/como-exportar-y-borrar-las-contrasenas-google-chrome-n5185939
Xbox sortea impresionante PC gamer con forma de motor de avión;https://www.ambito.com/informacion-general/microsoft/xbox-sortea-impresionante-pc-gamer-forma-motor-avion-n5185949
China avanza en el despliegue de la red 5G más grande del mundo;https://www.ambito.com/negocios/tecnologia/china-avanza-el-despliegue-la-red-5g-mas-grande-del-mundo-n5185900
Liderada por Manchester City, la Premier League hiere de muerte a la Superliga Europea;https://www.ambito.com/deportes/manchester-city/liderada-la-premier-league-hiere-muerte-la-superliga-europea-n5186066
Barcelona no se sumará a la Superliga europea y Messi podrá jugar el Mundial;https://www.ambito.com/deportes/barcelona/no-se-sumara-la-superliga-europea-y-messi-podra-jugar-el-mundial-n5186061
El circuito independiente de teatro asegura que no resistirá otro año cerrado;https://www.ambito.com/espectaculos/teatro/el-circuito-independiente-asegura-que-no-resistira-otro-ano-cerrado-n5185825
Francella, Érica Rivas y la polémica por Casados con hijos que no tiene fin;https://www.ambito.com/espectaculos/casados-hijos/francella-erica-rivas-y-la-polemica-que-no-tiene-fin-n5185923
Downton Abbey: cuándo se estrena la parte 2 de la película;https://www.ambito.com/espectaculos/series/downton-abbey-cuando-se-estrena-la-parte-2-la-pelicula-n5185631
Seguro para el auto: paso a paso qué hacer desde el choque al arreglo final;https://www.ambito.com/negocios/seguros/seguro-el-auto-paso-paso-que-hacer-el-choque-al-arreglo-final-n5186040
El artículo de Time que destaca a la Argentina por la recuperación feminista del Covid-19;https://www.ambito.com/economia/covid-19/el-articulo-time-que-destaca-la-argentina-la-recuperacion-feminista-del-n5186025
Cuándo cobro ANSES: calendario de pago de AUH, Progresar, Tarjeta Alimentar y jubilaciones del 21 de abril;https://www.ambito.com/informacion-general/anses/cuando-cobro-calendario-pago-auh-progresar-tarjeta-alimentar-y-jubilaciones-del-21-abril-n5186089
La soja subió 1,6% y superó los u$s540 por tonelada;https://www.ambito.com/economia/soja/la-subio-16-y-supero-los-us540-tonelada-n5185921
De Mendiguren: Las pymes que financiamos pronostican un crecimiento del 30% para este año;https://www.ambito.com/economia/pymes/de-mendiguren-las-que-financiamos-pronostican-un-crecimiento-del-30-este-ano-n5186106
Cómo invertir en criptomonedas;https://www.ambito.com/finanzas/criptomonedas/como-invertir-n5185819
La impresionante fortuna que amasó José Mourinho a base de despidos;https://www.ambito.com/deportes/mourinho/la-impresionante-fortuna-que-amaso-jose-base-despidos-n5185929
Bebés que lloran mucho: cómo entender y manejar su llanto;https://docsalud.com/
Qué es la depresión reactiva y cómo reconocerla;https://docsalud.com/
Histórico: helicóptero Ingenuity de la NASA realizó su primer vuelo en Marte;https://www.ambito.com/informacion-general/nasa/historico-helicoptero-ingenuity-la-realizo-su-primer-vuelo-marte-n5185584
Suscribite al newsletter de Ámbito;https://www.ambito.com/economia/finanzas/suscribite-al-newsletter-ambito-n5108585
Piden archivar una denuncia penal del diputado Iglesias contra el Presidente;https://www.ambito.com/politica/fiscal/piden-archivar-una-denuncia-penal-del-diputado-iglesias-contra-el-presidente-n5186026
La Mesa de Enlace se declaró en estado de alerta por nuevas medidas;https://www.ambito.com/politica/mesa-enlace/la-se-declaro-estado-alerta-nuevas-medidas-n5185996
Personal de salud de Jujuy cobrará dos bonos por un total de $14.000;https://www.ambito.com/politica/salud/personal-jujuy-cobrara-dos-bonos-un-total-14000-n5186115
Ferreyra y el lawfare: Nos asfixiaron para sacarnos los activos;https://www.ambito.com/politica/mauricio-macri/ferreyra-y-el-lawfare-nos-asfixiaron-sacarnos-los-activos-n5185931
Larreta respondió preguntas en Reddit;https://www.ambito.com/politica/reddit/larreta-respondio-preguntas-n5186037
Producción de la vacuna rusa en el país: celebración en el oficialismo y silencio opositor;https://www.ambito.com/politica/sputnik-v/produccion-la-vacuna-rusa-el-pais-celebracion-el-oficialismo-y-silencio-opositor-n5186058
Una mujer fue elegida por primera vez al frente de la UCR Capital;https://www.ambito.com/ucr/una-mujer-fue-elegida-primera-vez-al-frente-la-capital-n5186105
Nuevos créditos para construcción: cómo son, cuáles son los requisitos y cómo anotarse;https://www.ambito.com/economia/construccion/programa-casa-propia-como-son-los-nuevos-creditos-hipotecarios-n5185787
Gobierno lanzó créditos para construcción de vivienda con tasa atada al salario;https://www.ambito.com/economia/alberto-fernandez/gobierno-lanzo-creditos-construccion-vivienda-tasa-atada-al-salario-n5185769
Una falla en WhatsApp expone tus datos más sensibles;https://www.ambito.com/informacion-general/whatsapp/una-falla-expone-tus-datos-mas-sensibles-n5185896
DogeDay: cómo los seguidores de Dogecoin llevaron la criptomoneda a un nuevo récord;https://www.ambito.com/negocios/bitcoin/dogeday-como-los-seguidores-dogecoin-llevaron-la-criptomoneda-un-nuevo-record-n5185912
Cómo era el proyecto de Superliga Sudamericana liderado por Boca y River;https://www.ambito.com/deportes/boca/como-era-el-proyecto-superliga-sudamericana-liderado-y-river-n5185997
El PAMI abrió 3 vacunatorios para jubilados en la Ciudad: ¿dónde están ubicados?;https://www.ambito.com/informacion-general/pami/el-abrio-3-vacunatorios-jubilados-la-ciudad-donde-estan-ubicados-n5185942
Japón evalúa confinar Tokio y Osaka por el estallido de casos de coronavirus;https://www.ambito.com/mundo/tokio/japon-evalua-confinar-y-osaka-el-estallido-casos-coronavirus-n5185963
Falleció el periodista y escritor Daniel Muchnik;https://www.ambito.com/informacion-general/periodista/fallecio-el-y-escritor-daniel-muchnik-n5186047
Para contener la inflación, Gobierno pone en marcha el observatorio de precios;https://www.ambito.com/economia/inflacion/para-contener-la-gobierno-pone-marcha-el-observatorio-precios-n5185886
Banco Mundial espera que los precios de commodities se mantengan firmes el resto del año;https://www.ambito.com/economia/banco-mundial/espera-que-los-precios-commodities-se-mantengan-firmes-el-resto-del-ano-n5185987
Gobierno ampliará el alcance de la Tarjeta Alimentar;https://www.ambito.com/politica/tarjeta-alimentar/gobierno-ampliara-el-alcance-la-n5185937
Newells debutó en la Sudamericana con un empate en Brasil;https://www.ambito.com/deportes/sudamericana/newells-debuto-la-un-empate-brasil-n5186099
Argentinos se aprovechó de la inactividad de Nacional para sumar de a tres;https://www.ambito.com/deportes/argentinos/se-aprovecho-la-inactividad-nacional-sumar-tres-n5186096
Hinchas visitantes alquilaron un departamento del estadio para ver a su equipo;https://www.ambito.com/deportes/hinchas/visitantes-alquilaron-un-departamento-del-estadio-ver-su-equipo-n5186088
Delbonis, el último argentino en pie en Belgrado;https://www.ambito.com/deportes/delbonis/el-ultimo-argentino-pie-belgrado-n5186084
Independiente sufrió una nueva baja por coronavirus;https://www.ambito.com/deportes/independiente/sufrio-una-nueva-baja-coronavirus-n5185760
Superliga europea: la millonaria diferencia con la Champions League y el banco estadounidense que la financiará;https://www.ambito.com/deportes/superliga/europea-la-millonaria-diferencia-la-champions-league-y-el-banco-estadounidense-que-la-financiara-n5185626
Coronavirus: diseñan un sistema de anillos en hospitales porteños ante recrudecimiento de casos;https://www.ambito.com/informacion-general/hospitales/coronavirus-disenan-un-sistema-anillos-portenos-recrudecimiento-casos-n5186087
CaixaBank propone el mayor ajuste de la banca española, con miles de despidos;https://www.ambito.com/mundo/caixabank/propone-el-mayor-ajuste-la-banca-espanola-miles-despidos-n5185899
Coronavirus: cae la expectativa de vida en San Pablo por primera vez en 80 años;https://www.ambito.com/mundo/san-pablo/coronavirus-cae-la-expectativa-vida-primera-vez-80-anos-n5185945
Para Europa, la vacuna de Johnson & Johnson tiene más beneficios que riesgos;https://www.ambito.com/mundo/estados-unidos/para-europa-la-vacuna-johnson-johnson-tiene-mas-beneficios-que-riesgos-n5185913
Oficializan el Repro para trabajadores independientes del sector gastronómico;https://www.ambito.com/economia/repro/oficializan-el-trabajadores-independientes-del-sector-gastronomico-n5185925
Actualizan el aplicativo para declarar las ganancias de las personas jurídicas;https://www.ambito.com/economia/afip/actualizan-el-aplicativo-declarar-las-ganancias-las-personas-juridicas-n5185894
Por falta de autos, las ventas de 0 km crecen menos de lo esperado;https://www.ambito.com/economia/autos/por-falta-las-ventas-0-km-crecen-menos-lo-esperado-n5185837
Inflación: mal pronóstico de los analistas;https://www.ambito.com/economia/inflacion/analistas-pesimistas-la-region-y-mas-argentina-n5185859
Alimentos subieron 25 puntos por encima del IPC en los últimos 4 años;https://www.ambito.com/economia/alimentos/subieron-25-puntos-encima-del-ipc-los-ultimos-4-anos-n5185853
Pandemia: obras sociales también con internación saturada y sin refuerzos de fondos en el horizonte;https://www.ambito.com/politica/obras-sociales/pandemia-tambien-internacion-saturada-y-refuerzos-fondos-el-horizonte-n5185864
Ramos Padilla, sobre fallo por clases presenciales: La Justicia puede agravar la pandemia;https://www.ambito.com/politica/clases/ramos-padilla-fallo-presenciales-la-justicia-puede-agravar-la-pandemia-n5185907
Nicolás Kreplak: Los 50 mil casos diarios promedio es el escenario más optimista;https://www.ambito.com/ambito-nacional/provincia/nicolas-kreplak-los-50-mil-casos-diarios-promedio-es-el-escenario-mas-optimista-n5185866
Con criticas a los gremios, Macri salió a respaldar a Larreta por las clases presenciales;https://www.ambito.com/politica/clases-presenciales/con-criticas-los-gremios-macri-salio-respaldar-larreta-las-n5185770
Servini le pide al juez Hornos que dé un paso al costado;https://www.ambito.com/politica/gustavo-hornos/servini-le-pide-al-juez-hornos-que-un-paso-al-costado-n5185726
Caruso Lombardi podría dirigir en Europa: un equipo lo busca para salvarse del descenso;https://www.ambito.com/deportes/caruso-lombardi/podria-dirigir-europa-un-equipo-lo-busca-salvarse-del-descenso-n5185651
Platense sorprendió a Banfield;https://www.ambito.com/deportes/platense/sorprendio-banfield-n5185789
Manchester United confirmó la salida de una pieza clave de la Superliga Europea;https://www.ambito.com/deportes/manchester-united/confirmo-la-salida-una-pieza-clave-la-superliga-europea-n5186076
Cascini le respondió al Pollo Vignolo y dijo que hay mucha saña con Boca;https://www.ambito.com/deportes/boca/cascini-le-respondio-al-pollo-vignolo-y-dijo-que-hay-mucha-sana-n5185668
Los motivos por los que Bayern Munich le bajó el pulgar a la Superliga europea;https://www.ambito.com/deportes/superliga/los-motivos-los-que-bayern-munich-le-el-pulgar-la-europea-n5185683
El Leeds de Bielsa sería uno de los grandes beneficiados por la nueva Superliga;https://www.ambito.com/deportes/marcelo-bielsa/el-leeds-bielsa-seria-uno-los-grandes-beneficiados-la-nueva-superliga-n5185715
